0.89427079999999981,00:13:42.008,00:13:45.109,Only instead of you know good and bad cancer tumors
0.89427079999999981,00:13:45.170,00:13:46.812,or benign malignant tumors.
0.8942708,00:13:46.812,00:13:49.093,"We instead have have diabetes or not,"
0.8942708,00:13:49.093,00:13:51.555,and so we will use that as a supervised.
0.8942708,00:13:51.555,00:13:54.738,"We will solve that as a supervised learning problem,"
0.8942708,00:13:54.738,00:13:58.170,just like we did for the breast tumor data.
0.91773045099999984,00:13:58.170,00:14:00.814,So that's it for unsupervised learning.
0.91773045100000039,00:14:00.814,00:14:04.353,And in the next video will delve more into specific
0.91773045100000039,00:14:04.423,00:14:08.448,learning algorithms and start to talk about just how these
0.91773045100000039,00:14:08.517,00:14:12.265,albums work and how we can go about implementing them.
